{
  "schema": "stellar-verification-page",
  "schema_version": "1.0",
  "order": "asc",
  "cursor": "1788876003900-3f8c2a1b9e4d7c05a6b3f8129d4e5a7c0b1d2e3f4a5b6c7d8e9f0a1b2c3d4e5f",
  "records": [
    {
      "schema": "stellar-verification-aggregate",
      "schema_version": "1.0",
      "wasm_hash": "3f8c2a1b9e4d7c05a6b3f8129d4e5a7c0b1d2e3f4a5b6c7d8e9f0a1b2c3d4e5f",
      "updated_at": "2026-09-08T14:00:03.900Z",
      "source_code_verifications": [
        {
          "verifier": {
            "url": "https://verify.example.org",
            "name": "Example Verify"
          },
          "status": "verified",
          "recipe_source": "on_chain_metadata",
          "image_trust_level": "sdf_trusted",
          "bldimg": "docker.io/stellar/stellar-cli@sha256:1a2b3c4d5e6f708192a3b4c5d6e7f8091a2b3c4d5e6f708192a3b4c5d6e7f809",
          "bldopt": [
            "--package=token"
          ],
          "source_sha256": "9c8b7a6d5e4f30211f2e3d4c5b6a79880f1e2d3c4b5a69788796a5b4c3d2e1f0",
          "source_uri": "https://github.com/example/token/archive/refs/tags/v1.4.0.tar.gz",
          "processed_at": "2026-09-08T09:58:11.204Z",
          "results_urls": [
            {
              "type": "report",
              "location": "verifier_self_storage",
              "url": "https://verify.example.org/reports/5e4d3c2b1a09f8e7d6c5b4a39281706f5e4d3c2b1a09f8e7d6c5b4a392817060.json",
              "sha256": "5e4d3c2b1a09f8e7d6c5b4a39281706f5e4d3c2b1a09f8e7d6c5b4a392817060"
            },
            {
              "type": "report",
              "location": "arweave",
              "url": "ar://kP7nQx2LmR9vT4wY6bH1cJ8sD3fG5aZ0eN2iU7oX9yM",
              "sha256": "5e4d3c2b1a09f8e7d6c5b4a39281706f5e4d3c2b1a09f8e7d6c5b4a392817060"
            }
          ],
          "verified_source_code_uris": [
            {
              "location": "verifier_self_storage",
              "url": "https://verify.example.org/sources/9c8b7a6d5e4f30211f2e3d4c5b6a79880f1e2d3c4b5a69788796a5b4c3d2e1f0.tar.gz"
            }
          ],
          "schema_version": "1.0",
          "retrieved_at": "2026-09-08T14:00:03.512Z"
        }
      ],
      "unavailable_verifiers": [],
      "agreement": "single"
    }
  ]
}
